{
  "schema_version": 1,
  "run_id": "2026-07-30T16-47-41-681Z_427e700f48d4",
  "timestamp": "2026-07-30T16:47:41.681Z",
  "revision": {
    "commit": "427e700f48d4ba603a591ea67ef23c7c5540458f",
    "source_date": "2026-07-29T12:21:10+02:00",
    "tags": []
  },
  "harness": {
    "protocol": "munkbench-v1",
    "commit": "427e700f48d4ba603a591ea67ef23c7c5540458f"
  },
  "environment": {
    "id": "reference-server-v1",
    "hostname": "43ceb01da859",
    "cpu_model": "unknown",
    "cpu_quota": "",
    "compiler": "cc (Ubuntu 15.2.0-4ubuntu4) 15.2.0",
    "cmake": "cmake version 3.31.6",
    "platform": "linux-x64",
    "load_average_start": [
      0
    ]
  },
  "configuration": {
    "build_type": "Release",
    "extra_c_flags": [],
    "warmup": 2,
    "samples": 10,
    "batch": "auto",
    "cpu_affinity": "0"
  },
  "validation": {
    "passed": true,
    "checkpoints": "0,1,10,50"
  },
  "benchmarks": [
    {
      "name": "FallingSquares",
      "size": 10,
      "batch": 1,
      "samples": [
        {
          "sample": 1,
          "init_time_s": 0.00007,
          "run_time_s": 0.150092
        },
        {
          "sample": 2,
          "init_time_s": 0.00007,
          "run_time_s": 0.150164
        },
        {
          "sample": 3,
          "init_time_s": 0.000069,
          "run_time_s": 0.150147
        },
        {
          "sample": 4,
          "init_time_s": 0.00007,
          "run_time_s": 0.150297
        },
        {
          "sample": 5,
          "init_time_s": 0.00007,
          "run_time_s": 0.150295
        },
        {
          "sample": 6,
          "init_time_s": 0.00007,
          "run_time_s": 0.150201
        },
        {
          "sample": 7,
          "init_time_s": 0.000069,
          "run_time_s": 0.150129
        },
        {
          "sample": 8,
          "init_time_s": 0.00007,
          "run_time_s": 0.150313
        },
        {
          "sample": 9,
          "init_time_s": 0.00007,
          "run_time_s": 0.150381
        },
        {
          "sample": 10,
          "init_time_s": 0.000071,
          "run_time_s": 0.150146
        }
      ],
      "summary": {
        "median_run_time_s": 0.1501825,
        "p05_run_time_s": 0.15010865,
        "p95_run_time_s": 0.1503504,
        "median_init_time_s": 0.00007
      }
    },
    {
      "name": "FallingCircles",
      "size": 10,
      "batch": 2,
      "samples": [
        {
          "sample": 1,
          "init_time_s": 0.000131,
          "run_time_s": 0.122173
        },
        {
          "sample": 2,
          "init_time_s": 0.000131,
          "run_time_s": 0.122325
        },
        {
          "sample": 3,
          "init_time_s": 0.000132,
          "run_time_s": 0.122001
        },
        {
          "sample": 4,
          "init_time_s": 0.000131,
          "run_time_s": 0.122189
        },
        {
          "sample": 5,
          "init_time_s": 0.00013,
          "run_time_s": 0.121899
        },
        {
          "sample": 6,
          "init_time_s": 0.00013,
          "run_time_s": 0.121607
        },
        {
          "sample": 7,
          "init_time_s": 0.00013,
          "run_time_s": 0.121458
        },
        {
          "sample": 8,
          "init_time_s": 0.00013,
          "run_time_s": 0.122233
        },
        {
          "sample": 9,
          "init_time_s": 0.000131,
          "run_time_s": 0.122056
        },
        {
          "sample": 10,
          "init_time_s": 0.00013,
          "run_time_s": 0.122212
        }
      ],
      "summary": {
        "median_run_time_s": 0.06105725,
        "p05_run_time_s": 0.060762525,
        "p95_run_time_s": 0.061141799999999996,
        "median_init_time_s": 0.00006525
      }
    },
    {
      "name": "Tumbler",
      "size": 50,
      "batch": 1,
      "samples": [
        {
          "sample": 1,
          "init_time_s": 0.000005,
          "run_time_s": 0.10768
        },
        {
          "sample": 2,
          "init_time_s": 0.000005,
          "run_time_s": 0.107779
        },
        {
          "sample": 3,
          "init_time_s": 0.000005,
          "run_time_s": 0.107646
        },
        {
          "sample": 4,
          "init_time_s": 0.000006,
          "run_time_s": 0.10746
        },
        {
          "sample": 5,
          "init_time_s": 0.000005,
          "run_time_s": 0.107676
        },
        {
          "sample": 6,
          "init_time_s": 0.000005,
          "run_time_s": 0.107602
        },
        {
          "sample": 7,
          "init_time_s": 0.000006,
          "run_time_s": 0.107472
        },
        {
          "sample": 8,
          "init_time_s": 0.000005,
          "run_time_s": 0.107472
        },
        {
          "sample": 9,
          "init_time_s": 0.000005,
          "run_time_s": 0.107603
        },
        {
          "sample": 10,
          "init_time_s": 0.000006,
          "run_time_s": 0.107655
        }
      ],
      "summary": {
        "median_run_time_s": 0.10762450000000001,
        "p05_run_time_s": 0.1074654,
        "p95_run_time_s": 0.10773445,
        "median_init_time_s": 0.000005
      }
    },
    {
      "name": "AddPair",
      "size": 100,
      "batch": 4,
      "samples": [
        {
          "sample": 1,
          "init_time_s": 0.000333,
          "run_time_s": 0.100906
        },
        {
          "sample": 2,
          "init_time_s": 0.000343,
          "run_time_s": 0.101358
        },
        {
          "sample": 3,
          "init_time_s": 0.000334,
          "run_time_s": 0.100642
        },
        {
          "sample": 4,
          "init_time_s": 0.000334,
          "run_time_s": 0.101228
        },
        {
          "sample": 5,
          "init_time_s": 0.000335,
          "run_time_s": 0.101436
        },
        {
          "sample": 6,
          "init_time_s": 0.000334,
          "run_time_s": 0.10103
        },
        {
          "sample": 7,
          "init_time_s": 0.000333,
          "run_time_s": 0.100736
        },
        {
          "sample": 8,
          "init_time_s": 0.000334,
          "run_time_s": 0.100904
        },
        {
          "sample": 9,
          "init_time_s": 0.000337,
          "run_time_s": 0.101179
        },
        {
          "sample": 10,
          "init_time_s": 0.000333,
          "run_time_s": 0.101317
        }
      ],
      "summary": {
        "median_run_time_s": 0.025276125,
        "p05_run_time_s": 0.025171075,
        "p95_run_time_s": 0.025350225,
        "median_init_time_s": 0.0000835
      }
    },
    {
      "name": "MildN2",
      "size": 10,
      "batch": 10,
      "samples": [
        {
          "sample": 1,
          "init_time_s": 0.000309,
          "run_time_s": 0.11377
        },
        {
          "sample": 2,
          "init_time_s": 0.000309,
          "run_time_s": 0.114008
        },
        {
          "sample": 3,
          "init_time_s": 0.000312,
          "run_time_s": 0.113784
        },
        {
          "sample": 4,
          "init_time_s": 0.000309,
          "run_time_s": 0.113667
        },
        {
          "sample": 5,
          "init_time_s": 0.000308,
          "run_time_s": 0.114205
        },
        {
          "sample": 6,
          "init_time_s": 0.000316,
          "run_time_s": 0.115306
        },
        {
          "sample": 7,
          "init_time_s": 0.000328,
          "run_time_s": 0.118482
        },
        {
          "sample": 8,
          "init_time_s": 0.000312,
          "run_time_s": 0.114956
        },
        {
          "sample": 9,
          "init_time_s": 0.000329,
          "run_time_s": 0.116417
        },
        {
          "sample": 10,
          "init_time_s": 0.000312,
          "run_time_s": 0.114907
        }
      ],
      "summary": {
        "median_run_time_s": 0.0114556,
        "p05_run_time_s": 0.011371335,
        "p95_run_time_s": 0.011755274999999999,
        "median_init_time_s": 0.0000312
      }
    },
    {
      "name": "N2",
      "size": 25,
      "batch": 60,
      "samples": [
        {
          "sample": 1,
          "init_time_s": 0.00083,
          "run_time_s": 0.103619
        },
        {
          "sample": 2,
          "init_time_s": 0.000832,
          "run_time_s": 0.10363
        },
        {
          "sample": 3,
          "init_time_s": 0.000835,
          "run_time_s": 0.103774
        },
        {
          "sample": 4,
          "init_time_s": 0.00083,
          "run_time_s": 0.103603
        },
        {
          "sample": 5,
          "init_time_s": 0.000831,
          "run_time_s": 0.103676
        },
        {
          "sample": 6,
          "init_time_s": 0.000827,
          "run_time_s": 0.103758
        },
        {
          "sample": 7,
          "init_time_s": 0.00083,
          "run_time_s": 0.103708
        },
        {
          "sample": 8,
          "init_time_s": 0.000829,
          "run_time_s": 0.103692
        },
        {
          "sample": 9,
          "init_time_s": 0.000837,
          "run_time_s": 0.103789
        },
        {
          "sample": 10,
          "init_time_s": 0.000837,
          "run_time_s": 0.103628
        }
      ],
      "summary": {
        "median_run_time_s": 0.0017280666666666666,
        "p05_run_time_s": 0.0017268366666666666,
        "p95_run_time_s": 0.0017297041666666667,
        "median_init_time_s": 0.000013841666666666668
      }
    },
    {
      "name": "Multifixture",
      "size": 5,
      "batch": 3,
      "samples": [
        {
          "sample": 1,
          "init_time_s": 0.003745,
          "run_time_s": 0.102662
        },
        {
          "sample": 2,
          "init_time_s": 0.003695,
          "run_time_s": 0.10147
        },
        {
          "sample": 3,
          "init_time_s": 0.003655,
          "run_time_s": 0.102198
        },
        {
          "sample": 4,
          "init_time_s": 0.003644,
          "run_time_s": 0.101699
        },
        {
          "sample": 5,